,title,company,location,salary,summary
238,"Data Analytics/Science Manager, Global Network Operations",PwC,London,,"Knowledge of working with large data sets performing statistical analysis, data visualization, data mining, and data cleansing/transformation/processing."
239,Data Scientist,Robert Walters,London,,Collating and cleaning data from various entities.5+ years’ experience of applied data science.Demonstrable history of devising and overseeing data-centred…
240,Machine Learning Consultant,CGI,London,,"You will explore and visualise data, identify differences in data distribution that could affect performance when deploying the model in the real world, and…"
241,Senior Data Scientist,"Fiserv, Inc.",Basildon,,Assess the effectiveness of data sources and data-gathering techniques and improve data collection methods.Business lead for data driven projects to build EMEA…
242,Data Engineer | PM Analytics,Liquidnet,London,,The data engineering team works to develop and deploy our data science models efficiently and at scale.We leverage cloud technologies to streamline deployment…
243,"Senior Data Scientist, Insights & Innovation, UK",Amazon EU SARL (UK Branch),London,,We are looking for a customer obsessed Senior Data Scientist who can innovate in a greenfield space and derive risk insights from massive amounts of data and…
244,Senior Data Scientist,NP Group,London,"£70,000 - £100,000 a year","You'll come from a strong statistical analysis/mathematical background with experience in developing probability models for forecasting, prediction and…"
245,DATA SCIENTIST,DataSpartan Consulting,London EC2V 7RS,,"Collaborate with our data analysts to map data fields to hypotheses and curate, wrangle, and prepare data for use in their advanced analytical models."
246,Machine Learning Engineer (data scientist),Staff Worx,London,,"Work with other data scientists, engineers, product owners, business analysts and delivery leads.Manipulate data and rapidly prototype and communicate…"
247,Data Scientist (Energy / Decarbonisation),Amida Recruitment Limited,London,"£60,000 - £75,000 a year",Leverage their network of domain experts to explore and identify innovative data products and data analytic solutions that add value to their clients.
248,Assistant or Associate Professor – Head of Data Science,London School of Hygiene & Tropical Medicine,London,"£46,704 - £64,817 a year","The candidate must possess a doctoral degree in Statistics, Machine Learning, Mathematics, Computer Science or any other quantitative field and possess…"
249,Data Scientist - Pricing,Harnham,London,"£60,000 - £80,000 a year",Proven commercial experience working as a data scientist in financial services or insurance.Excellent communication skills and ability to express how data…
250,"Software Engineer, Machine Learning",Thread,London,,"Apply If this role sounds exciting to you, please apply below. If you’re unsure, please still get in touch—we welcome applicants from different backgrounds…"
251,Data Scientist,Nicholson Glover Consulting,London,,At least 2 years’ experience with data manipulation and ML.You will play a pivotal role in the team delivering data-driven results and insights to improve the…
252,Data Scientist/Bioinformatician,Morgan Hunt,London,,"This role needs specialist knowledge in data science, data visualisation, data analysis, software development and ideally bioinformatics, AI and machine…"
253,Marketing Data Scientist,Aspire,West End,"£45,000 - £60,000 a year","Strong experience in working with data in a commercial setting (ideally agency), being able to deliver presentations to non-technical audiences."
254,Data Scientist,Michael Page UK,London,£300 - £350 a day,Exposure to working with data scientists and machine learning projects.Experience working with sensitive or personally identifiable data and handling…
255,Natural Language Processing Engineers,Pangaea Data,London,,Pangaea Data Limited provides a machine learning based software product to its customers from the biopharmaceutical and healthcare industry for faster…
256,Data Scientist (Investment),Harnham,London,"£70,000 - £80,000 a year",Apply ML techniques to alternative data sources to identify insightful investment opportunities.Build ML models focused on customer recommendation and consumer…
257,Interim Data Scientist - Remote Working,Triumph Consultants Ltd,London,£400 a day,Experience working with sensitive or personally identifiable data and handling associated governance issues.Analytical or Research experience from any relevant…
258,Data Scientist,Datatech Analytics,London,"£60,000 a year","§c3+ years data industry experience gained ideally within financial services and/or commercially focused organisations.§Working knowledge of R, Python or SAS."
259,Machine Learning Researcher,G-Research,London,,We will also consider exceptional candidates with a proven record of success in online data science competitions (e.g. Kaggle).
260,Data Science Specialist - London,Echobox,London,,"Working knowledge of big data architectures, i.e. NoSQL, Hadoop etc.You will assist in the customisation of the product for new customers and trial data…"
261,Senior Data Scientist,Opus Recruitment Solutions,London,"£60,000 - £85,000 a year","The Data team is relatively new, and where you will have responsibility and autonomy in your role around delivering projects into production."
262,Machine Learning Engineer,Propel,London,"£80,000 - £100,000 a year","Deploy machine learning models alongside data scientists.As a Senior Python Engineer with machine learning experience, you will work closely with a research…"
263,"Consultant, Data Scientist, Defence and Security, SAMA, Cons...",Deloitte,London,,"0px;""≥ face=""Arial""≥Experience with data architecture, cloud architecture and data security/governance; < > li≥ face=""Arial"" size=""2""≥."
264,Data Scientist,Explore Group,London,"£50,000 - £60,000 a year",Lots of great benefits and bonuses.Client does not offer sponsorship.Strong and recent experience working as an out-and-out Data Scientist.
265,Turing Talent Data Science / Machine Learning Internship Pro...,Turing Talent,London,,Identifying opportunities and putting the systems in place to capitalize on email performance data.Turing Talent Data Science / Machine Learning Internship…
266,"Head of Data, Data Science + Engineering",Trainline,London,,"Our Data Engineers are responsible for our real time data processing platform, which processes billions of rows a day into our Data Lake and hosts a number of…"
267,Data Scientist (Outside IR35),Marcus Donald People,Canary Wharf,£500 - £650 a day,"This Data Scientist will have a love for ML and AI and be highly skilled with Python, Tensorflow, AWS among other technologies."
268,Data Scientist – Insurance,Lawes Group,London,"£40,000 - £45,000 a year",This Data Scientist needs to bring enthusiasm to the role – they will be looking at improving adoption of data and analytics throughout the organisation and…
269,Pricing Data Scientist,ADLIB,London,"£50,000 - £60,000 a year","Because of their continued interest in the area, they have recently partnered with one of the UK’s leading Red Brick Universities for research and collaboration…"
270,"Senior Data Scientist, Financial Crime",Monzo,London,,"Work closely with financial crime analysts, data scientists and engineers to understand the underlying business problem and propose an appropriate solution …"
271,Data Scientist - Machine Learning,Harnham,London,£500 - £600 a day,"Previous experience working as a Machine Learning Engineer in e-commerce is highly valuable as you will be dealing with data sources such as customer data,…"
272,Applied Scientist - Trust and Safety,Yelp,London,,As an Applied Scientist on Trust & Safety you will employ your analytical skills to detect and understand content spam at Yelp.
273,"Data Science Lead, Reliability Analytics",Google,London,,"Experience in working with large scale data systems for acquisition, storage, and management of complex data flow."
274,"Executive, Decision Analytics & Modelling, UK&I, London",EY,London,,"Our work typically involves constructing purpose-built databases storing large client datasets for our analytical models, using data transformation tools,…"
275,Internship in Natural Language Processing (NLP),G-Research,London,,"An interest in applying data science, machine learning and optimisation techniques to real-world problems.10 week summer programme (July to September 2021)."
276,Lead Data Scientist,BBOXX,London,,"We are looking for a self-driven lead data scientist to join the expanding team who will drive Bboxx analytics roadmap, engage with business leaders to…"
277,Senior Consulting Manager - Data & Analytics,Sopra Steria,London EC1A,,"Collaborate with specialist consultant and delivery colleagues, notably with our technical disciplines including our industry leading data scientists, and…"
278,"Internship in Quantitative Research (Data Science, Machine L...",G-Research,London,,"An interest in applying data science, machine learning & optimisation techniques to real-world problems.We pair this expertise with machine learning, big data,…"
279,Machine Learning Quantitative Analyst,UBS,London,,You will have strong experience analysing time-series data ideally knowledge of building and optimising order execution strategies.Kx Kdb or SQL experience.
280,Senior Lecturer in Artificial Intelligence and Machine Learn...,London Metropolitan University,London,"£42,273 - £53,172 a year","Walks of life, creating and advancing social justice, social mobility.The Computer Science and Applied Computing subject area provides a."
281,Data & Analytics Consultant (m/f/d),Artefact,London,,"Optionally, knowledge of data processing and data modeling algorithms and techniques.A minimum of 1 year of work experience in a data-driven working…"
282,Head of Data Science UK,Sedgwick,London,,Contribute to development of current data pipelines.Contribute to the maintenance and deployment of data enrichment repositories.
283,AI/ML Developer,Healios,London N7 9AH,"£75,000 a year","Experience utilising data science in a commercial setting.Set up, develop and manage data sets in a cloud-based architecture to use for machine learning…"
284,Analytics Engineer,Cera Care,London EC1A 2BN,,"You’ll develop and manage data products, including flat tables that make it easy for reporting analysts using BI tools, and normalising data into schemas that…"
285,"Data Science Consultant, Data Analyst (London)",GreySpark Partners,London,,Understanding of data best practices and basic data governance principles.These can range from electronic trading driven data analysis projects to data…
286,Data Scientist | Python | Perm | London/Remote,GCS Recruitment Specialists Ltd,London,"£50,000 - £70,000 a year","You will have good experience working with large data sets.Any experience doing data engineering in the cloud would be good such as AWS or GCP for example,…"
287,UK Head of Data & AI,Cognizant Microsoft Business Group,London,,"Working knowledge and experience of data science/AI practices and processes including building industry relevant data sets, machine learning, predictive…"
288,Principal Data and Analytics Strategy Consultant,AWS EMEA SARL (UK Branch),London,,"12+ years of related experience in data management and data architecture.Experience managing data operations, cloud computing, data strategy, data governance,…"
289,Big Data Engineer,CGI,London,,As the successful candidate you will offer a demonstrable track record in building scalable big data solutions with a view to act as a trusted technology…
290,Senior Data Scientist,SRGEurope,London,,Conduct data preparation to integrate data from sources and prepare data ready for modelling and analysis.Highly data and statistical driven.
291,Senior Data Scientist – London,kdr Recruitment,London,"£75,000 - £90,000 a year","My client is looking for an experienced Data Scientist @ Senior level, to help build & design new data applications & implement frameworks."
292,Statistician,The Economist Newspaper Limited,London E14,,Basic knowledge of querying data using SQL would be preferable.Prior experience in the domain of macro-economic or financial data would be an advantage.
293,"Senior Consultant, Customer & Personalisation Analytics Spec...",Deloitte,London,,Experience in measuring the uplift of data driven marketing.You’ll build trusted relationships with business stakeholders – and use the most exciting new…
294,Statistician,Lucid,London,,"Experience working with big data technologies (e. g. Spark).Ability to manipulate, analyze, and interpret large data sources."
295,Head of Data Science,Financial Times,London,,Implementing talent development frameworks and helping early career data scientists realise their potential.Teams of up to three data scientists work together…
296,NLP Engineer,Propel,London,"£100,000 a year","Strong experience with Python and its data science libraries.You’ll work on the entire pipeline, from data collection and modelling, to prototyping, coding and…"
297,Senior Data Scientist,Lawrence Harvey,London,"£65,000 - £80,000 a year","Working knowledge of a range of AI techniques (deep learning, graph data analytics, NLP, Machine Learning).Delivering client solutions through a range of Data…"
298,Head of Data Science,Mott MacDonald,London,,Create data pipelines for more efficient and repeatable data science projects.Train peers on specialist data science topics.Pension matched up to 7%.
299,Senior Data & Analytics Manager,RELX Group,London,,"Knowledge of data warehouse, ETL processes and data modelling.Delivering strategic and tactical planning, with a hands-on delivery focus, the Senior Data…"
300,Senior Data Scientist,Harnham,London,"£50,000 - £90,000 a year",You will identify opportunities to utilise data science to make improvements to the business.You will use advanced analytics and modelling techniques looking…
301,Data Scientist (Contract),Harnham,London,£450 - £550 a day,For this contract we are looking for individuals that come from a strong Mathematics/ Statistics background and have worked in either Research or Data…
302,Machine Learning Engineer Internship,G-Research,London,,Knowledge of algorithm and data structure fundamentals.Experience and coursework in machine learning and data science.
303,Remote Data Scientist / Machine Learning Engineer - Time Ser...,GCS Recruitment Specialists Ltd,London,"£40,000 - £90,000 a year","Experience with working on large data sets and data preprocessing/wrangling.Strong organisational and self-starting skills, happy to work in a team and…"
304,Graph Data Science Product Manager - London,Neo4j,London,,Conduct market research into competing graph data science libraries and other data science platforms to understand differentiating features and potential…
305,"Data Science Director, Community Integrity",Facebook,London,,"Inspire, lead and grow 25+ data scientists across multiple teams.The data science team partners as fellow product leads with product managers, software…"
306,Computer Vision Deep Learning Engineer,Humanising Autonomy,London WC2R,,"Working closely with other vision engineers, embedded engineers, data scientists, and behavioural scientists to understand how behavioural insights can be…"
307,Senior Applied Scientist - Information Retrieval and Natural...,Evi Technologies Limited,London,,"Ph.D. in Machine Learning, Natural Language Processing, Information Retrieval or a related discipline.Strong publication record at top academic conferences…"
308,Senior Data Scientist - Marketing / Growth,Cuvva,London,"£80,000 a year","Own the build out of Cuvva’s marketing data analysis stack including data pipeline, tagging and attribution modelling.A day off to volunteer."
309,Data Science Contractor (£600-£700 per day),MBN Recruitment Solutions,London,£600 - £700 a month,"You will work on a range of areas including pricing, supply chain, online, computer vision/security among others from PoC through to production and deployment."
310,ARTIFICIAL INTELLIGENCE SPECIALIST,DataSpartan Consulting,London EC2V 7RS,,Work closely with data scientists to solve difficult engineering and machine learning problems and produce high-quality code.
311,Data Scientist,Metrica Recruitment,London,"£70,000 - £80,000 a year",Strong data analysis skills with ability to drill down into complex dataset.They help young people learn how to manage money responsibly under the guidance of…
312,Data Science Engineer - London,Echobox,London,,"Working knowledge of big data architectures, i.e. NoSQL, Hadoop etc.You will assist in the customisation of the product for new customers and trial data…"
313,Senior Data Science Analyst,Revionics,London,,"Awareness of data load and ETL / Automation tools (Informatica, etc.).Collaborate with other members of the data science teams to help improve existing…"
314,"PhD Student, London (AI)",Facebook,London,,Devise data-driven models of human behaviour.Perform research that improves computational understanding and representing of data.
315,Data Scientist,H&R Talent,London,"£55,000 - £65,000 a year",Building tools to automate data collection.Experience with common data science toolkits.Knowledge in developing software and data models.
316,Data Scientist - Inside IR35,Harnham,London,£550 a day,Proven experience applying data scientist techniques to customer behaviour.You should have experience working on complex data sets and exposure to tools such…
317,"Assistant Manager/Manager, M&A Analytics, Transaction Servic...",Deloitte,London,,"Manipulate large data sets to provide compelling, value add outputs.Ability to ETL client data to facilitate analysis / visualization."
318,Senior Manager - Data and Analytics,KPMG,London,,"Developing and delivering data strategy, data operating model, data governance or data maturity programmes for public sector clients."
319,Senior Data Scientist,dotdigital,Croydon CR0 6SD,,Expertise in building data visualisations to explain data stories.Proven experience as a Senior Data Scientist and in leading and mentoring other data…
320,Quant Analytics Lead,Shell,London,,"Demonstrate strong technology and coding skills coupled with knowledge of data science (eg Python, SQL).Build research frameworks and quant libraries, model…"
321,"Product Owner, Endeavor Analytics",Endeavor,London,,"Good overall understanding of data products including science, analytics, reporting, dashboarding, Big Data and data warehousing."
322,Software Engineer - Machine Learning,Yelp,London,,"Experience with data ETL and data analysis packages and workflows (SQL, MapReduce, Spark, etc.).Lead the development of machine learned models for offline,…"
323,Machine Learning Product Owner - Data Science & AI,Asos.com,London,,"Collaborate with machine learning scientists, engineers and architects to translate business problems into machine learning problems."
324,Data Scientist (Python and R) - Contract - West London,Lorien,West London,£600 - £650 a day,Provide help on monitoring ongoing data quality and model performance.Proven extensive experience developing and implementing Machine Learning algorithms on…
325,Data Scientist,Opus Recruitment Solutions,London,"£50,000 - £85,000 a year","The Data team is relatively new, and where you will have responsibility and autonomy in your role around delivering projects into production."
326,Data Scientist - R& Python,Metrica Recruitment,West London,"£35,000 - £40,000 a year","As a data scientist, you will be responsible for utilising the most cutting edge data techniques to deliver bespoke solutions to both internal stakeholders and…"
327,Data Scientist - Python PhD Computer Vision,Client Server,London,"£65,000 - £80,000 a year","The organisation's powerful core product is an open, SaaS API platform that transforms the quality of data captured to simplify workflows and drive actions."
328,Python Backend Engineer - Machine Learning,"JPMorgan Chase Bank, N.A.",London,,"Practical experience with statistical data analysis and experimental design.You will participate in the research lifecycle beginning with problem discovery,…"
329,International Analytics Manager,Marks & Spencer,Paddington,,Provide insight into our business and customers through the interrogation of data and actively encourage the use data to “answer” business questions.
330,Data Scientist - Gaming/ Betting,Harnham,London,"£50,000 - £80,000 a year",Extensive previous commercial experience as a data scientist/ machine learning engineer.Utilising large amounts of digital betting data to maximise revenue.
331,Data Scientist - Python Programmer,Michael Page UK,London,£300 - £400 a day,Exposure to working alongside with data scientists and machine learning projects.A track record of working with sensitive or personally identifiable data and…
332,Data Scientist - Clinical Supply Chain,GSK,Ware SG12 0DP,,Manage automated data extractions and intermediate transformation platforms.>3 years experience with data transformation tools.
333,Data and Analytics developer,Austin Fraser,London,"£60,000 - £70,000 a year","Excellent Knowledge of data & analytics.Strong understanding of data science, machine learning, AI, and predictive/statistical modelling."
334,Faculty for Business Analytics,EF Education First,London WC1N 2AT,,It provides students with the skills to conduct analyses with large sets of data to inform business decisions.
335,"Data Scientist (Contractor) - Python, R, SQL",Harnham,London,£450 - £550 a day,"As a contractor you would be helping the client build analytics tool, working on machine learning and optimisation models and liaising directly on the company's…"
336,Data Scientist - ML Labs,AWS EMEA SARL (UK Branch),London,,"Strong communication and data presentation skills.We’re looking for top ML data scientists capable of using ML and other techniques to design, evangelize, and…"
337,Principal Data Scientist,Harnham,London,"£110,000 - £120,000 a year",Working as part of a team of 8 (x4 data scientists / x4 machine learning engineers).Data and analytics drives decisions within all aspects of their…
338,Lead Data Scientist,Harnham,London,"£60,000 - £75,000 a year",You will use your specialist knowledge in Machine Learning and Python/R to build innovative solutions and have the chance to learn and progress in new areas.
339,Senior Data Scientist,Consortia,London,"£80,000 - £90,000 a year","The role will be to build sophisticated machine learning models around audience modelling, behaviour analysis and optimisation models to name a few."
340,Machine Learning Engineer - London,Echobox,London,,"Working knowledge of big data architectures, i.e. NoSQL, Hadoop etc.You will assist in the customisation of the product for new customers and trial data…"
341,Engineering – Eqs Prime Services Strats – Client Analytics –...,Goldman Sachs,London EC4A 2BE,,You will use data-driven insights from usage patterns and user feedback to develop ideas into intuitive and efficient real-time workflow tools.
342,Senior Data Scientist - Challenger Stockbroker,Michael Page UK,London,"£60,000 - £75,000 a year",Advance the overall quality of their data understanding whilst improving data standards across the business.Strong technical skills in data related tech (i.e.…
343,"Manager, AI Risks and Ethics, Data Risk Analytics, London",Deloitte,London,,Proven ability to deliver complex data analytics and machine learning projects.Familiarity and competency with some of the key tools used in information…
344,Senior Data Scientist,Blue Pelican,London,"£60,000 - £70,000 a year","A background in data science; (possibly) data engineering, (definitely) machine learning and AI, ideally within a marketing environment."
345,Data Scientist,Blue Legal,London,"£40,000 - £55,000 a year",Proven experience as a data scientist.Familiarity with cloud-based data science and machine learning services and APIs (e.g. Microsoft Azure).
346,Senior Data & AI Business Consultant,Avanade,London,,"An interesting data, advanced analytics, data science, technology, and business intelligence background.Experience working with clients to solve key data and…"
347,Data Scientist,Austin Fraser,London,,"The contract is for a minimum of 6 months.You have strong skills in Python and AWS.SQL, Tableau, Power BI are also preferable."
348,Machine Learning Engineer,G-Research,London,,"Writing custom libraries for efficiently training on terabytes of data.We pair this expertise with machine learning, big data, and some of the most advanced…"
349,Data Scientist - Machine Learning (Python/SQL),Linux Recruit,London,"£70,000 - £100,000 a year","You will be involved in the full lifetime of their data products responsible for analysis of data to inform strategic business decisions, designing and building…"
350,Analytics Cloud Engineer,Kensington Mortgages,London,,¿ Work with data scientists and analytics developers to design and build secure and scalable machine learning platform in Azure.
351,Machine Learning Researcher,Brave Software Inc.,London,,"Basic data cleansing and preparation, variable preprocessing/transformation.Preparation of data sets for predictive modelling, robust predictive model building…"
352,Data Scientist (Contract) - Inside IR35,Harnham,London,£500 - £600 a day,"Working on a Data Science contract for leading Insurance company, the client has received a large round of funding and are a looking to scale up customer…"
