,title,company,location,salary,summary
121,"Senior Data Scientist, Product Analytics",Monzo,London,,We work in cross-functional squads where every data scientist is a member of a central data discipline and fully embedded into 1 product squad alongside…
122,Data Scientist,Nesta,London,"£38,000 - £50,000 a year","These data scientists will be at the forefront of designing, scoping and delivering data science projects that deliver impact in these areas."
123,Machine Learning Scientist (London),GreySpark Partners,London,,Supervising the data acquisition process if more data is needed.Ability to understand various data structures and common methods in data transformation.
124,Data Scientist,EMR Marketing Recruitment,London,£450 - £550 a day,"Experienced in handling big data (Hadoop, Teradata, etc.).8-10 years' hands-on experience in data analytics.Support AI/ML model development."
125,Senior Data Scientist - Global participation,Twitter,London,,You provide strong technical mentorship to other data scientists and uplevel the overall technical bar of the DS team.
126,Senior Data Scientist,Vodafone,London,,"Expertise in data manipulation: use of structured data tools (e.g., SQL), & unstructured data tools and platforms (e.g., Spark, NoSQL)."
127,"Senior Applied Data Scientist, AI and Optimization Lead - At...","JPMorgan Chase Bank, N.A.",London,,"Experience with big data technologies, modern data engineering practices, frameworks and data visualization tools."
128,Customer Analytics Data Scientist Senior Associate,PwC,London,,"Propose data science problem solving approaches.Prototype, test and improve new data science models.Strong technical expertise in data science, statistical…"
129,Senior Data Scientist,Funding Circle UK,London EC4V,,"Utilising the most innovative data sources and modelling techniques.Demonstrable experience in a decision scientist or modeller role, ideally from a company…"
130,DX Development Data Scientist,"Sony Europe BV, United Kingdom",Weybridge,,Look for opportunities to implement additional AI technology to enhance data quality (Material mapping / Crawling / Support to external data cleansing such as…
131,PRINCIPAL DATA SCIENCE ENGINEER,SBTech,London,,"Extensive experience as the expert on a data science team where you were responsible for all aspects of data science technical projects, including development…"
132,Customer Analytics Data Scientist - Manager,PwC,London,,Track record of professional achievements to include leading teams of data scientists and analysts in project work.Own the data science solution in production.
133,"Data Scientist – Lead Data Scientist, Analytics & Cognitive,...",Deloitte,London,,"Knowledge of enterprise data architecture and data modelling.Candidates should have a passion for data, a strong background in either data science (including…"
134,Data Scientists - Consulting,PA Consulting Group,London,,We are looking for data architects who know how the future data platforms look like and know how they interact with existing legacy clients’ architecture.
135,Machine Learning/Data Mining Scientist for Cancer Prediction...,University of Hertfordshire,Hatfield,"£30,000 - £35,000 a year","Stage 2: Compliance to all ethical, regulatory and data requirements.Professional and/or industrial experience of data science, AI and."
136,Senior Data Scientist,Bumble,London,,"Collaborate with internal business stakeholders, data scientists and engineers in order to identify improvement opportunities from an AI perspective."
137,Front End Developer - AM Research Data Science - Associate,"JPMorgan Chase Bank, N.A.",London,,"Research Notes provides a platform for the authoring and distribution of internal analyst research reports for company, manager, fund and other qualitative…"
138,Data Science Degree Apprenticeship Programme 2021 – London,Amey plc,London,,"Contribute to delivering data insights through reports, real-time dashboards and intuitive data visualizations.Data Science Degree Apprenticeship Programme."
139,Data Scientist - Manager - UKI Assurance - Forensic Data Ana...,Ernst & Young,London,,"Carry out reactive and proactive data analysis of large structured and unstructured datasets, from a variety of data sources.Ideally, you’ll also have."
140,Lead Data Scientist,FIRST Global Events Agency,London,,"A background in data science; data engineering, machine learning and AI, ideally within a marketing environment."
141,Strategic Consultant - Data Science & Analytics,Amey plc,London,,"Have experience with big data technologies e.g. Spark, Cassandra.Help clients to make better use of their data and drive intelligent decision making."
142,Senior Data Scientist,Kainos,London,,"Senior Data Scientists apply their skills in quantitative analysis, data mining, machine learning and data presentation (storytelling) to see beyond the numbers…"
143,Data & Analytics Delivery Leader,Marsh and McLennan,London EC3R 5BU,,Work with board members and other executives to establish the vision for managing data as a business asset — to exploit data using research and analytics to…
144,IT Security Data Scientist,"Nomura Holdings, Inc.",London,,"We are looking for someone keen to make an impact by using data to make more intelligent, data driven decisions.Strong data management skills including SQL."
145,Junior Data Scientist,Lawrence Harvey,London,,"This can include data analytics, data science, data strategy or data governance disciplines.Develop and build data and technology solutions/service offering…"
146,Senior Product Data Scientist,Harnham,London,"£55,000 - £80,000 a year",A high-growth Food/Tech giant with millions of customers globally are seeking to expand their Data Science function.You will have commercial experience in SQL.
147,Senior Data Scientist - Digital,CAPCO,London,,"In addition to this, they will be expected to leverage their expertise to train and grow junior / graduate data scientists from the ground up."
148,Quantitative Developer/Data Scientist - CryptoCurrency,Opus Recruitment Solutions,London,"£100,000 a year","My Client is crypto currency high frequency trading business.Although they would describe themselves as a start up; they are successful and profitable, hence…"
149,Data Scientist,Aspire,London,"£60,000 - £70,000 a year",Deliver a variety of analytics and audience data modelling solutions within the advertising and media sector.Support the development of innovative products and…
150,Principal Data Scientist,Expedia Group,London EC1V 4EX,,Good data manipulation skills required including cleaning and managing data.Experience with data visualization tools and packages.
151,Senior Data Scientist / ML Engineer,Novafutur,London,,Our data scientist should be very good at working and communicating within an existing team and collaborating on a daily basis.
152,Senior Data Scientist,OpenMarket,London W4,,Advise on our data platform architecture and its ability to support our data science needs.Understand and analyze our data sets and provide a holistic view of…
153,"Partner Engineer - Network Analytics, Intern",Facebook,London,,"Familiar with big data analytics tools, and conducting large scale analysis.Experience using analytical tools (Tableau, statistical, visualization, GIS /…"
154,Lead Data Scientist,Kainos,London,,"Significant experience in cleansing, filtering and re-factoring complex data from different sources (including non-traditional data sources)."
155,"Senior Data Scientist, Marketing",Deliveroo,London,,Our team members use technical skills from the whole spectrum of data science: building analytical tools; informing decision making at all levels of the…
156,Quantum Machine Learning Scientist,Cambridge Quantum Computing,London,,"For example, parameterized quantum circuits (PQC) can be trained to perform tasks such as classification, regression, and generative modelling (see our recent…"
157,Sr. Data Scientist - ML Labs,AWS EMEA SARL (UK Branch),London,,Strong communication and data presentation skills.Analyze and extract relevant information from large amounts of historical data to help automate and optimize…
158,Senior Data Scientist - London or UK-Based Telecommute,UnitedHealth Group,London,,Well-rounded data science skill set.A passion for problem solving using data and analytics.Experience with Tableau or other data visualization tools is highly…
159,Lead Data Scientist,Kindred Group,London,,We have invested heavily in data technologies and associated analytical tools that enables our data scientist to provide innovative solutions using the latest…
160,Machine Learning Engineer - Data Science & AI,Asos.com,London,,Building and improving internal and external facing data products as part of a cross-functional tea m.The ability to work collaboratively and proactively in a…
161,"Insight Manager, Analytics (Financial Services)",Head Office,London SW1E 5NN,,"Technical skill, knowledge and experience in the use of Big Data, data visualisation, data manipulation and enterprise reporting techniques and tools."
162,Quantitative Researcher (Data Science/Machine Learning/Mathe...,G-Research,London,,"We pair this expertise with machine learning, big data, and some of the most advanced technology available to predict movements in financial markets."
163,Curious Data Scientists,Camden A.I.,London,,"Research and/or development experience in working with large data sets.Experience working with SQL and No-SQL databases, data visualization technologies and…"
164,"Data Security Engineer, Endeavor Analytics",Endeavor,London,,"This is a new technical role dedicated to ensuring our data remains secure by monitoring, enforcing and implementing new processes."
165,Data Engineering & Analytics,STEM Graduates,London,"£32,000 a year",Created a data analytics database for computational chemistry as part of a wider data infrastructure for augmented drug discovery.
166,Head of Data Science & Tools,Croud,London EC2A 4AA,"£7,500 a month","Integrating data systems and automated ETL.In-depth demonstrable experience in data science.Data tools and products development, which increases agency…"
167,Senior Data Scientist - Forensic Data Analytics - London,Ernst & Young,London,,"Managing teams of data scientists, engineers and data analysts, driving the direction of solution development, providing technical and managerial leadership and…"
168,Principal Data Scientist - Experian DataLabs,Experian,London,,Designing appropriate data structure and data storage schemes for efficient data manipulation and information retrieval.Conducting ROI and benefit analysis.
169,Data Scientist - Risk,Harnham,London,£550 - £650 a day,"As a Data Scientist, you will be working on model governance projects.You will be designing and developing different risk models using logistic regression,…"
170,Senior Data Scientist,The Trade Desk,London,,"You are a broadly skilled data scientist with experience embedding models into always-on production systems, working across a variety of technologies and data…"
171,Deputy Director of Data & Analytics,UK Government - Department of Health and Social Ca...,London,"£71,000 a year","Support the NHSX Deputy Director of Data Policy in development of policy related to data and the NHSX Chief Technology Officer in developing standards, an…"
172,Senior Data Scientist,Wood Plc,Staines-upon-Thames,,"Bachelor’s or post-graduate degree in data science, statistics or related quantitative field or chemical engineering with strong data science skills."
173,Principal Scientist - Patient Data Analytics,UCB S.A.,Slough,,Deliver projects in compliance with UCB’s data governance policies around patient data use.Experience with data cleaning/munging and analysis in the context of…
174,Junior Machine Learning Engineer - London,Echobox,London,,"Working knowledge of big data architectures, i.e. NoSQL, Hadoop etc.You will assist in the customisation of the product for new customers and trial data…"
175,"Senior Data Scientist, Customer Care, Forecasting",Deliveroo,London,,Our team members use technical skills from the whole spectrum of data science: building analytical tools; informing decision making at all levels of the…
176,"Research Scientist - Artificial Intelligence, Machine Learni...",Afiniti,London,,"The R&D team works intimately with our production data scientists, so the role can involve assisting with particularly tricky client models and developing new…"
177,Senior Geospatial Data Scientist,BuroHappold Engineering,London,,Taking the lead on the development of data science related projects and analytics products with underlying spatial data to develop our new urban analytics…
178,Data Analytics Assistant Manager – IGH Analytics,KPMG,London,,"Developing and delivering data strategy, data operating model, data governance or data maturity programmes for public sector clients."
179,Junior Data Scientist (Risk/Audit),Lawrence Harvey,London,,"This can include data analytics, data science, data strategy or data governance disciplines.Develop and build data and technology solutions/service offering…"
180,Senior Data Scientist,The Culture Trip,London,,"Experience in a technical leadership capacity, mentoring junior data scientists and leading technical development.50% off Pure Gym annual membership."
181,Senior Data Scientist,Refinitiv,London,,"Working with large, diverse data sets using big data and public cloud technology.Ability to track down complex data quality and data integration issues,…"
182,Data Scientist,Ocado Retail,Hatfield,,Cluster computing data processing frameworks (e.g. Spark).Experience conducting analysis on large data sets and providing rigorous interpretations of the…
183,"Senior Data Scientist, Advanced Analytics",IHS Markit,London EC2Y,,"Develop models, algorithms and data pipelines that leverage wealth of IHS Markit data to provide actionable insights to clients."
184,Data Scientist,Harnham,London,"£60,000 - £80,000 a year","Present results from your own research to senior members throughout the organisation using data visualisation.Up to £80,000 + competitive bonus & benefits."
185,Audience Measurement - Senior Data Scientist,Ipsos,London,,"Developing machine learning models with senior data scientist guidance.Manipulating data and data processing in R, Python, SQL and Google Cloud Platform."
186,"Visiting Scientist, Core Data Science",Facebook,London,,"Experience in scalable dataset assembly / data wrangling, such as Presto, Hive or Spark.Experience doing empirical research using data analysis tools such as R…"
187,Senior Data Scientist,Direct Line Group,Bromley,,"The Senior Data Scientist will have access to a wide range of internal and external data sets, such as digital customer journeys, breakdown data and sales data."
188,Data Science Practitioner,Cognizant,London,,"You will be working in a variety of data science settings, using a diverse set of tools to automat computational statistics."
189,Data Science Manager - EMEA,Mintel,London,,"Shape the capabilities and quantitative expertise for Mintel's fast growing team of data scientists, engineers and data analysts.1+ year as a people manager."
190,"Consultant, Geospatial Analytics, Consulting, London",Deloitte,London,,"Experience with business intelligence, analytics, data, databases and predictive modelling.< > ul≥ < > li≥ face=""Arial"" size=""2""≥Project delivery specialising…"
191,Skills Transformation Consultant (Data focus),Coursera,London,,"Understand of emerging data technologies.7+ years of business experience with 4+ years of experience as a data scientist, machine learning engineer, software…"
192,Senior Data Scientist,Badoo App,London,,"Collaborate with internal business stakeholders, data scientists and engineers in order to identify improvement opportunities from an AI perspective."
193,Data Analytics Manager – IGH Analytics,KPMG,London,,"Developing and delivering data strategy, data operating model, data governance or data maturity programmes for public sector clients."
194,Research Intern (AI) - London,Facebook,London,,"Devise data-driven models of human behaviour.Ability to manipulate and analyse large scale, high-dimensionality data from varying sources."
195,Data and Analytics Consultant,Hearst Media Services,London,,Assess the effectiveness of data sources and data-gathering techniques and improve data collection methods.Liaise with client stakeholders to communicate data…
196,Senior Data Scientist,Expedia Group,London EC1V 4EX,,Demonstrated ability to build and maintain multiple data science projects/products in production environments.At least 5 years related profession experience.
197,Data Scientist (All Levels),Harnham,London,"£55,000 - £110,000 a year",Work on a range of Machine Learning projects.Build and deploy Machine Learning models to solve commercial challenges.
198,"Executive, Decision Analytics & Modelling, Health Sector, UK...",EY,London,,"Our work typically involves constructing purpose-built databases storing large client datasets for our analytical models, using data transformation tools,…"
199,Senior Solutions Data Scientist - UK,primer.ai,London,,"Train, deploy, and tune machine learning models on customer data sets.We build systems that read documents, extract insights, and write reports comparable to…"
200,Machine Learning Researcher/Engineer,Samsung Electronics,Staines-upon-Thames,,The AI team at Samsung Research UK is looking for exceptional AI and ML experts to join the growing team in Staines-upon-Thames.
201,UK Head of Data & AI,Cognizant's Microsoft Business Group,London,,"Working knowledge and experience of data science/AI practices and processes including building industry relevant data sets, machine learning, predictive…"
202,Senior Data Scientist,GfK,London,,"Proven experience in senior data science/quantitative data analysis or related areas.Be part of a cross-functional development team, providing guidance and…"
203,Data Scientist,Talent International,London,£400 - £425 a day,"This role is outside of IR35 and will be remote until post COVID-19, when occasional travel to London will be required."
204,"Director, Data Science",Bain & Company Inc,London,,"3+ years of experience managing data scientists.Translate business objectives into data and analytics solutions and, translate results into business insights…"
205,"Applied Science Internship - Machine Learning, Automated Rea...",Amazon Dev Centre (London) Ltd,London,,"We are looking for smart scientists capable of using a variety of domain expertise combined with machine learning and statistical techniques to invent, design,…"
206,Natural Language Processing (NLP),Digital insight,London,,"This is a developer role and you would have some prior experience in developing systems round Information extraction (entity & relationship), entity resolution,…"
207,"Consultant, Artificial Intelligence Specialist: Analytics an...",Deloitte,London,,Be responsible for the high quality delivery of key parts of our engagements working with our senior data scientists.Structured approach to problem solving.
208,Quantitative Researcher in Natural Language Processing (NLP),G-Research,London,,This is a pure research role that would suit those who enjoy finding relationships in large data sets and working out how to interpret these results.
209,Analytics Engineer,Royal Mail Group,London EC1A 1AA,,"Comprehensive understanding of data lakes, database design, data warehouses and data modelling.Expert knowledge of visualisation design and data-driven user…"
210,MSAT Graduate – Data Science (12 Month Fixed Term),MeiraGTx,London,,The Data Sciences team is responsible for optimising research data workflows and developing data analysis tools thus enabling data driven analysis.
211,Junior Data Scientist,Blue Pelican,London,"£25,000 - £35,000 a year","Some commercial experience in data science; (possibly) data engineering, (definitely) machine learning and AI, ideally within a marketing environment."
212,"Data Science Analyst, Ascential Marketing Division",Ascential,London,,Provide subject matter expertise on data science to the wider business.Collaborate with other Data Science teams across the Ascential Group to share best…
213,"Technical Sourcer, Data Science",Deliveroo,London,,"We’re offering permanent and contract roles based in the UK or remote across Europe where we have a local presence (Ireland, France, Spain, Poland and the…"
214,"Head of Data Science, Financial Crime",Monzo,London,,Set the data strategy for financial crime data - from working with engineers on ensuring that we capture the right data to building predictive models that help…
215,Data Scientist - NLP,Harnham,London,"£65,000 - £70,000 a year","Work on a range of NLP topics to help understand social media data, and sentiment of users.Harnham are currently working with a start-up in London who are…"
216,Data Analytics Expert,Altran,Slough,,"Perform required data extraction, cleanup and transformation to produce customized data extracts, reports and insights using data available from Customer…"
217,"Capital, Control and Operations Big Data Architect",Deutsche Bank,London,,"Knowledge of big data analytics, data science, Artificial Intelligence/ Machine Learning is beneficial.Capital, Control and Operations (CCO) is transforming…"
218,Principal Applied Scientist,Microsoft,London,,"Excellent problem solving and data analysis skills, with expertise in developing or applying predictive analytics, statistical modelling, data mining, or…"
219,Data Science Consultant,ZS Associates,London,,"Data Science Consultants (DSCs) design, develop and execute analytic techniques on large, complex, structured and unstructured data sets (including big data) to…"
220,Data Scientist,Oscar Technology,London,"£55,000 - £75,000 a year","After an incredible 2020 sales figures wise, as well as doubling the company size, they are now looking to add grow their Data Scientist team by a few heads to…"
221,"Senior Data Scientist, On-Demand Convenience",Deliveroo,London,,Our team members use technical skills from the whole spectrum of data science: building analytical tools; informing decision making at all levels of the…
222,CIB Applied AI & Machine Learning - Digital & Platform Servi...,"JPMorgan Chase Bank, N.A.",London,,Hands-on experience analyzing data.Research and analyze data sets using a variety of statistical and machine learning techniques.
223,Contract Data Scientist,Explore Group,London,£400 - £450 a day,Data Science/ Data Scientist/ Data/ Science/ Scientist/ Contract/ Python/ Machine Learning/ Development Background/ Software Engineering/ SQL/ Insights/…
224,Data Scientist,Gold Group,London,£400 - £425 a day,"You will benefit from, and contribute to, our growing data science code repository and work efficiently with our data science environment."
225,Machine Learning Engineer,Deliveroo,London,,"You will be working in a cross-functional team alongside engineers, data scientists specialized in analytics and inference, and product managers to develop…"
226,Artificial Intelligence,Kainos,London,,Exposure to applying mathematics principles to gain insight from data.Experience of building and testing software applications that integrate AI services and…
227,Pricing Data Scientist,Harnham,London,"£60,000 - £80,000 a year","Ideally, you will have experience analysing customer, transactional and/or online data.Use SQL and R/Python daily to analyse millions of rows of data to help…"
228,Data Scientist,Consortia,London,£600 a day,Understand contributing data sources and implement robust transformation pipeline using DBT and Airflow.I am looking for a contract Data Scientist to lead the…
229,SENIOR DATA SCIENTIST,DataSpartan Consulting,London EC2V 7RS,,"Knowledge of statistics, machine learning and data analytics techniques.You will bring an exceptional academic background in a technical field combined with…"
230,Applied Machine Learning Researcher (London),Seldon,London,,Within our Data Science team we work on distilling and conducting research to enable trust in production machine learning systems.
231,Senior Data Scientist,GSK,Brentford,,Demonstrable experience contributing to a data science project lifecycle.Practical experience developing and implementing machine learning on large data sets.
232,Junior NLP/Machine Learning Developer,ProWritingAid,London,,"You will implement, evaluate and maintain various Natural Language Processing algorithms.Build datasets for training and evaluation of NLP algorithms."
233,Decision Scientist,NatWest Group,London,,"Good understanding of analytical or database querying software, data visualisation software, big data environments and cloud environments."
234,Internship in Machine Learning,G-Research,London,,We will also consider exceptional candidates with a proven record of success in online data science competitions (e.g. Kaggle).
235,Global Proposition Leader in Data Science,Willis Towers Watson,London,,Awareness of main data enrichment sources and open source data assets most valuable to insurance companies.Sound experience of leading insurance data science…
236,"Intern, AI Lab UK (Summer)",Autodesk,London,,Implement AI agents and Machine Learning prototypes.Collaborate with researchers and developers in the team.Read papers and perform literature reviews.
237,Data Science & Management Consultant UK (m/f/x),Celonis SE,London,,"Over the whole course of the proof-of-value project, you proficiently handle our customers’ individual needs and actively participate in customer workshops."
